DatGeracaoConjuntoDados,NomAgente,IdeEmpresaProponenteProjeto,DscCodProjeto,DscTituloProjeto,DscTipologia,VlrCustoTotal,VlrRcbGlobal,VlrEnergiaEconomizadaTotal,VlrRetiradaDemandaPontaTotal,DscObjetivo,DscJustificativa,DatInicioProjeto,DatConclusaoProjeto,DscMetodologiaMv,Score,Address,Latitude,Longitude
2024-04-01,ENERGISA SUL-SUDESTE - DISTRIBUIDORA DE ENERGIA S.A.,967,PE-05216-0025/1999,Mudança do Nível de Tensão em Rede de Distribuição Primária,Pelo Lado da Oferta/Perdas,668762.61,0.0,7387.0,2932.75,,,1998-01-01,1999-12-31,,1.0020854355608453,,,
2024-04-01,Iguaçu Distribuidora de Energia Elétrica Ltda,1755,PE-00087-0005/2004,Substituição de Lâmpadas Incandescentes por Fluorescentes Compactas em Consumidores de Baixa Renda,Baixa Renda,9979.0,0.08,111.33,40.87,,,2003-01-01,2004-12-31,,1.0016117953948365,,,
2024-04-01,COPEL DISTRIBUICAO S.A.,726,PE-02866-0095/2004,Substituição de Lâmpadas em Unidades Consumidoras Residenciais Classificadas como Baixa Renda,Residencial,1098803.08,,11826.0,4536.0,,Projeto em andamento,2003-01-01,2004-12-31,,1.0006563894635434,"Copel Distribuição S.A., Rua Vicente Machado, Guarapuava, Região Geográfica Imediata de Guarapuava, Região Geográfica Intermediária de Guarapuava, Paraná, Região Sul, 85010-050, Brasil",-25.38696195,-51.474271
2024-04-01,LIGHT SERVIÇOS DE ELETRICIDADE S A,226,PE-00382-0024/2000,Parceria Light/ Cheque Cidadão: Doação de Lâmpadas,Residencial,591421.44,0.37,6570.0,2232.0,,Este projeto teve como objetivo a substituição de resfriador liquido de baixo rendimento. por resfriador liquido de alto rendimento. na unidade consumidora do Condomínio Goiabeiras Shopping Center não apresentou o rcb do projeto,1999-01-01,2000-12-31,,1.0006353379316841,,,
2024-04-01,LIGHT SERVIÇOS DE ELETRICIDADE S A,816,PE-00382-0059/2002,Conjuntos Habitacionais Populares - Doação de Lâmpadas,Residencial,129924.05,0.36,1441.0,490.0,,Projeto Cancelado,2001-01-01,2002-12-31,,1.0005817588946804,,,
2024-04-01,COPEL DISTRIBUICAO S.A.,95,PE-02866-0051/2004,Substituição de Lâmpadas em Unidades Consumidoras Residenciais de Baixa Renda,Residencial,1747539.32,0.07,17562.59,8232.46,,Pré(Projeto em andamento) Pós(Conforme mencionado nos itens anteriores. as dificuldades encontradas foram na sua totalidade problemas para se adequar as orientações emanadas dos órgãos do governo de SC. Quanto a problemas operacionais para a execução dos serviços de diagnósticos e projetos. algumas dificuldades foram acarretadas em função de que por se tratar a Segurança Pública de uma atividade de alto risco. nem sempre foi possível adentrar em alguns prédios. conforme cronograma de visitas elaborado e discutido com as unidades envolvidas. Fato este. que não comprometeu os trabalhos de campo com um atraso significativo.),2003-01-01,2004-12-31,,1.0003126848166901,"Copel Distribuição S.A., Rua Vicente Machado, Guarapuava, Região Geográfica Imediata de Guarapuava, Região Geográfica Intermediária de Guarapuava, Paraná, Região Sul, 85010-050, Brasil",-25.38696195,-51.474271
2024-04-01,CEMIG DISTRIBUIÇÃO S.A,590,PE-04950-0005/1999,Medição do Requisito de Energia Regional,Pelo Lado da Oferta/Perdas,550000.0,,4670.0,3420.0,,10 Refrigeradores substituidos ate o momento,1998-01-01,1999-12-31,,1.0001759771362508,,,
2024-04-01,ENERGISA MATO GROSSO DO SUL - DISTRIBUIDORA DE ENERGIA S.A.,1157,PE-00404-0040/2000,Instalação de Bancos Capacitores na Rede de Alta Tensão,Pelo Lado da Oferta/Perdas,680219.0,,8510.14,1450.0,,,1999-01-01,2000-12-31,,1.0,,,
